title,author,price
Thiết kế kết cấu bê tông cốt thép theo TCVN 5574-2018,Bùi Quốc Bảo,Chỉ từ 29.000₫
AUTOCAD cơ bản cho người mới bắt đầu (Dành cho phiên bản Autocad 2009.2020),Nguyễn Hoành,Chỉ từ 14.000₫
Bài tập Sức bền vật liệu tập 1,Chu Thanh Bình,Chỉ từ 14.000₫
Đầu tư bất động sản,Gary W. Eldred,Chỉ từ 71.000₫
Thiết kế mạng lưới thoát nước đô thị,Phạm Ngọc Sáu,Chỉ từ 24.000₫
Thành phố thông minh - khung quản trị và phát triển,ZAIGHAM MAHMOOD,Chỉ từ 60.000₫
Quy trình pháp lý đầu tư phát triển Dự án nhà ở thương mại,Trần Thanh Tiến,Chỉ từ 45.000₫
Thiết kế liên kết trong kết cấu thép theo tiêu chuẩn Mỹ AISC/LRFD 360-16,TS. Trần Văn Phúc,Chỉ từ 16.000₫
Thiết kế kết cấu thép nhà tiền chế,Nguyễn Hồng Sơn,Chỉ từ 27.000₫
Kết cấu bê tông cốt thép. Phần 2 Kết cấu công trình,Trần Thị Nguyên Hảo,Chỉ từ 16.000₫
Giáo trình xây dựng ứng dụng Web cho thương mại điện tử trên Netbeans,Nguyễn Văn Sinh,Chỉ từ 24.000₫
"Quy trình pháp lý thu hồi đất, trưng dụng đất, bồi thường, hỗ trợ tái định cư và giải quyết khiếu nại, tố cáo, khởi kiện của người có đất thu hồi, trưng dụng",Trần Thanh Tiến,Chỉ từ 36.000₫
Hệ thống giao thông thông minh trong các đô thị thông minh. Các khía cạnh và thách thức của mạng di động và đám mây,Rodolfo I. Meneguette,Chỉ từ 48.000₫
EXCEL nâng cao và các ứng dụng trong xây dựng,ThS. Phan Tự Hướng,Chỉ từ 36.000₫
Giáo trình hệ thống kỹ thuật trong công trình,Nguyễn Thị Huệ,Chỉ từ 15.000₫
AUTODESK REVIT TỔNG HỢP 3 TRONG 1,Lê Duy Phương,Chỉ từ 35.000₫
"Quy trình pháp lý thu hồi đất, trưng...",Trần Thanh Tiến,Chỉ từ 36.000₫
Nội thất và thiết kế nội thất Tập 2,Phạm Đình Việt,210.000₫
Mối quan hệ kiến trúc và các ngành...,Tôn Thất Đại,Chỉ từ 12.000₫
Thành phố thông minh - khung quản trị...,ZAIGHAM MAHMOOD,Chỉ từ 60.000₫
Hệ thống giao thông thông minh trong...,Rodolfo I. Meneguette,Chỉ từ 48.000₫
QCVN 13:2018/BXD Quy chuẩn kỹ thuật quốc gia về gara ô tô,Tiêu chuẩn quốc gia,Chỉ từ 10.000₫
Nội thất và thiết kế nội thất - Tập 1,Phạm Đình Việt,Chỉ từ 39.000₫
Định mức dự toán xây dựng công trình (Ban hành kèm theo TT số 10/2019/TT-BXD ngày 26/12/2019 của Bộ Xây dựng),Bộ Xây Dựng,Chỉ từ 67.000₫
Phân tích kết cấu xây dựng theo phương pháp phần tử hữu hạn và ứng dụng trong phần mềm Ansys,Lâm Thanh Quang Khải,Chỉ từ 23.000₫
Tổ chức không gian nhóm nhà ở chung cư theo hướng kiến trúc xanh,TS. Nguyễn Tiến Đức,Chỉ từ 10.000₫
Gió và tác động của gió lên công trình,Hoàng Nam,Chỉ từ 18.000₫
"Giáo trình cơ học đất, nền và móng",Phan Huy Đông,Chỉ từ 18.000₫
Gia cường kết cấu bê tông cốt thép bằng vật liệu tấm sợi composite,Nguyễn Trung Hiếu,Chỉ từ 12.000₫
Thiết kế kết cấu thép trong công trình xây dựng dân dụng và công nghiệp,Nguyễn Võ Thông,Chỉ từ 19.000₫
Đô thị vị nhân sinh,Jan Gehl,Chỉ từ 53.000₫
Giáo trình kết cấu công trình thép,TS. Lê Anh Thắng,Chỉ từ 27.000₫
Thiết kế kết cấu bê tông cốt thép theo tiêu chuẩn EUROCODE - Cơ sở lý thuyết và ví dụ áp dụng,Bùi Quốc Bảo,Chỉ từ 18.000₫
Tính toán thiết kế nhà cao tầng theo TCVN và tiêu chuẩn Châu Âu (EUROCODE),Đặng Tỉnh,Chỉ từ 19.000₫
Hướng dẫn thực hành thiết kế với REVIT Architecture,Nguyễn Thị Tâm Đan,Chỉ từ 14.000₫
"Ngôi nhà, nơi trú ngụ của trái tim - Tâm lý học nhà ở và nội thất",TOMODA HIROMICHI,Chỉ từ 29.000₫
Ứng dụng AUTODESK REVIT trong thiết kế công trình 3D theo công nghệ BIM REVIT STRUCTURE trong thiết kế kết cấu - Tập 1,Nguyễn Quốc Tới,Chỉ từ 31.000₫
"Quy trình pháp lý thu hồi đất, trưng...",Trần Thanh Tiến,Chỉ từ 36.000₫
Nội thất và thiết kế nội thất Tập 2,Phạm Đình Việt,210.000₫
Mối quan hệ kiến trúc và các ngành...,Tôn Thất Đại,Chỉ từ 12.000₫
Thành phố thông minh - khung quản trị...,ZAIGHAM MAHMOOD,Chỉ từ 60.000₫
Hệ thống giao thông thông minh trong...,Rodolfo I. Meneguette,Chỉ từ 48.000₫
Hướng dẫn thuyết minh tính toán đồ án môn học máy nâng,Dương Trường Giang,Chỉ từ 13.000₫
Kiến trúc và hiện tượng cộng sinh văn hóa,Lê Thanh Sơn,Chỉ từ 16.000₫
"Đất nền, nước ngầm và địa kỹ thuật công trình lãnh thổ Việt Nam",Nguyễn Gia Chính,Chỉ từ 90.000₫
Phần mềm Plaxis 2D Phân tích động trong tính toán thiết kế các công trình xây dựng,Đỗ Ngọc Viện,Chỉ từ 13.000₫
Định mức sử dụng vật liệu xây dựng (Ban hành kèm theo thông tư số 10/2019/TT-BXD ngày 26/12/2019 của Bộ Xây dựng),Bộ Xây Dựng,Chỉ từ 21.000₫
Lý thuyết trường điện từ với các chương trình MATLAB,Trần Văn Chính,Chỉ từ 19.000₫
Hướng dẫn đồ án môn học lập định mức kỹ thuật xây dựng,TS. Nguyễn Liên Hương,Chỉ từ 10.000₫
Kiến trúc nhà ở - Hiểu biết và thiết kế qua minh họa,Trần Minh Tùng,Chỉ từ 33.000₫
Sử dụng ABAQUS để mô phỏng nút liên hợp (Sách chuyên khảo),Lê Anh Thắng,Chỉ từ 12.000₫
"Tài liệu dạy, học Pháp luật (Chương trình đào tạo trình độ cao đẳng)",Bộ Lao động - Thương binh và Xã hội,Chỉ từ 10.000₫
Quy hoạch đô thị (Giáo trình dành cho sinh viên chuyên ngành kiến trúc),Phạm Hùng Cường,Chỉ từ 15.000₫
Vẽ phối cảnh kiến trúc và CAD,Vũ Tiến Đạt,Chỉ từ 10.000₫
Giáo trình Logic mờ & ứng dụng,Lê Xuân Vinh,Chỉ từ 14.000₫
Giáo trình cấu tạo kiến trúc công trình dân dụng,Võ Huy Dũng,Chỉ từ 13.000₫
Cầu vòm ống thép nhồi bê tông,Trần Bảo Xuân,Chỉ từ 54.000₫
Kết cấu bê tông cốt thép ứng suất trước theo tiêu chuẩn ACI 318 - 14 của Hoa Kỳ,TS. Nguyễn Việt Hưng,Chỉ từ 14.000₫
Kiến trúc nhà ở - Hiểu biết và thiết...,Trần Minh Tùng,Chỉ từ 33.000₫
"Quy trình pháp lý thu hồi đất, trưng...",Trần Thanh Tiến,Chỉ từ 36.000₫
Nội thất và thiết kế nội thất Tập 2,Phạm Đình Việt,210.000₫
Mối quan hệ kiến trúc và các ngành...,Tôn Thất Đại,Chỉ từ 12.000₫
Thành phố thông minh - khung quản trị...,ZAIGHAM MAHMOOD,Chỉ từ 60.000₫
Hệ thống giao thông thông minh trong...,Rodolfo I. Meneguette,Chỉ từ 48.000₫
Tính toán động đất và tải trọng gió theo tiêu chuẩn Châu Âu Eurocode,Đặng Tỉnh,Chỉ từ 15.000₫
Lịch sử vườn cảnh,TS. KTS Phạm Anh Tuấn,Chỉ từ 39.000₫
Biểu tượng và không gian kiến trúc đô thị,Lê Thanh Sơn,Chỉ từ 12.000₫
Cơ sở thiết kế và ví dụ tính toán kết cấu nhịp cầu dầm đơn giản bê tông cốt thép ứng suất trước bán lắp ghép theo tiêu chuẩn TCVN 11823:2017,Lê Bá Danh,Chỉ từ 11.000₫
Tin học ứng dụng trong quản trị sản xuất,ThS. Lê Đức Tâm,Chỉ từ 18.000₫
Phần mềm RSAP phân tích và thiết kế kết cấu chuyên nghiệp theo công nghệ BIM - Tập 1- Phân tích kết cấu,Nguyễn Quốc Tới,Chỉ từ 31.000₫
Giáo trình kinh tế xây dựng,PGS.TS. Bùi Mạnh Hùng,Chỉ từ 33.000₫
Nghiệp vụ đấu thầu - 300 câu hỏi đáp và xử lý tình huống trong đấu thầu truyền thống và đấu thầu qua mạng,TS. Trần Vinh Vũ,Chỉ từ 26.000₫
Định mức dự toán sửa chữa và bảo dưỡng công trình xây dựng (Ban hành kèm theo thông tư số 10/2019/TT-BXD ngày 26/12/2019 của Bộ Xây dựng),Bộ Xây Dựng,Chỉ từ 21.000₫
Hướng dẫn thiết kế kỹ thuật thi công mạng lưới cấp nước,Ths. Nguyễn Thị Thanh Hương,Chỉ từ 16.000₫
Bảo trì công trình xây dựng,TS Nguyễn Ngọc Thắng,Chỉ từ 15.000₫
Ứng dụng AUTODESK REVIT trong thiết kế kiến trúc,Nguyễn Mạnh Tuấn,Chỉ từ 16.000₫
TCVN 10304:2014 móng cọc tiêu chuẩn thiết kế,Tiêu chuẩn quốc gia,Chỉ từ 10.000₫
Thiết kế khung bê tông cốt thép toàn khối,Đặng Vũ Hiệp,Chỉ từ 24.000₫
Tải trọng và tác động của gió lên công trình,Nguyễn Võ Thông,Chỉ từ 14.000₫
Hình thái học đô thị,Doãn Minh Khôi,Chỉ từ 19.000₫
Kiến trúc nhà ở - Hiểu biết và thiết...,Trần Minh Tùng,Chỉ từ 33.000₫
"Quy trình pháp lý thu hồi đất, trưng...",Trần Thanh Tiến,Chỉ từ 36.000₫
Nội thất và thiết kế nội thất Tập 2,Phạm Đình Việt,210.000₫
Mối quan hệ kiến trúc và các ngành...,Tôn Thất Đại,Chỉ từ 12.000₫
Thành phố thông minh - khung quản trị...,ZAIGHAM MAHMOOD,Chỉ từ 60.000₫
Chinh phục trình diễn bằng Microsoft Powerpoint,Tống Xuân Tám,Chỉ từ 21.000₫
Giáo trình kỹ thuật động cơ đốt trong và xu hướng phát triển của động cơ,Đỗ Tiến Dũng,Chỉ từ 12.000₫
Quy trình vận hành hệ thống kênh tưới,Trần Văn Sửu,Chỉ từ 10.000₫
QCVN 01:2021/BXD Quy chuẩn xây dựng Việt Nam quy hoạch xây dựng,Tiêu chuẩn quốc gia,Chỉ từ 10.000₫
Giáo trình kết cấu bê tông cốt thép - Phần 1: Cấu kiện cơ bản,Vũ Tân Văn,Chỉ từ 34.000₫
Phân tích và thiết kế nền móng công trình với STAAD FOUNDATION V8I,Nguyễn Châu Lân,Chỉ từ 22.000₫
Tiêu chuẩn Việt Nam về vật liệu và môi trường,Tiêu chuẩn quốc gia,Chỉ từ 22.000₫
ANSYS - Ví dụ thực tế phân tích kết cấu công trình thuỷ lợi thuỷ điện (Practical applications in structural analysis of hydraulic works and hydropower dams),Vũ Hoàng Hưng,Chỉ từ 40.000₫
Phương pháp phần tử hữu hạn sử dụng Matlab,Nguyễn Thời Trung,Chỉ từ 31.000₫
Hướng dẫn đồ án môn học mạng lưới cấp nước,Đặng Thị Thanh Huyền,59.000₫
"SAP 2000 - Phân tích kết cấu công trình thủy lợi, thủy điện - Phần nâng cao",Vũ Hoàng Hưng,Chỉ từ 39.000₫
Bài tập và hệ thống bảng tra thủy văn công trình giao thông - Tập 5: Thiết kế và tính toán thủy văn - thủy lực hệ thống thoát nước đô thị,Phạm Văn Thoan,Chỉ từ 33.000₫
Định mức dự toán lắp đặt hệ thống kỹ thuật của công trình (Ban hành kèm theo TT số 10/2019/TT-BXD ngày 26/12/2019 của Bộ Xây dựng),Bộ Xây Dựng,Chỉ từ 31.000₫
Mối quan hệ kiến trúc và các ngành nghệ thuật,Tôn Thất Đại,Chỉ từ 12.000₫
Vật lý kiến trúc,Nguyễn Đình Huấn,Chỉ từ 15.000₫
Ứng dụng Csi ETABS 2015 trong phân tích kết cấu công trình,Trần Anh Bình,Chỉ từ 19.000₫
Kiến trúc nhà ở - Hiểu biết và thiết...,Trần Minh Tùng,Chỉ từ 33.000₫
"Quy trình pháp lý thu hồi đất, trưng...",Trần Thanh Tiến,Chỉ từ 36.000₫
Nội thất và thiết kế nội thất Tập 2,Phạm Đình Việt,210.000₫
Mối quan hệ kiến trúc và các ngành...,Tôn Thất Đại,Chỉ từ 12.000₫
Thành phố thông minh - khung quản trị...,ZAIGHAM MAHMOOD,Chỉ từ 60.000₫
Thiết kế nội thất,Đặng Thái Hoàng,139.000₫
Lập trình JAVA căn bản,Phạm Văn Trung,Chỉ từ 14.000₫
Kết cấu nhà bê tông cốt thép nhiều tầng,Nguyễn Lê Ninh,Chỉ từ 31.000₫
Ứng dụng phần mềm SAP 2000 giải bài toán kết cấu công trình,Nguyễn Hải Hưng,Chỉ từ 26.000₫
"Cẩm nang thông gió mỏ hầm lò, các đường hầm giao thông và quạt gió",PGS.TS Trần Xuân Hà,Chỉ từ 63.000₫
Quy hoạch chuẩn bị kỹ thuật khu đất xây dựng đô thị ứng phó với thiên tai và biến đổi khí hậu,Phạm Trọng Mạnh,Chỉ từ 18.000₫
Giáo trình lịch sử kiến trúc,PGS.TS.KTS. Nguyễn Đình Thi,Chỉ từ 38.000₫
Cầu thép theo TCVN 11823:2017,Nguyễn Văn Nhậm,Chỉ từ 24.000₫
Công nghệ cọc nâng cao( Sách chuyên khảo),Cao Văn Hóa,Chỉ từ 16.000₫
Giáo trình sức bền vật liệu,Trần Hưng Trà,Chỉ từ 16.000₫
Kết cấu thép thiết kế theo tiêu chuẩn Châu Âu,Nguyễn Hồng Sơn,Chỉ từ 21.000₫
Giáo trình thí nghiệm vi sinh vật môi trường,Đặng Vũ Bích Hạnh,Chỉ từ 10.000₫
Hướng dẫn thiết kế cầu dầm thép chữ I liên hợp bản bê tông cốt thép liên tục hai nhịp - Theo tiêu chuẩn thiết kế cầu đường bộ TCVN 11823.2017,Nguyễn Quốc Bảo,Chỉ từ 12.000₫
Công trình bến,PGS. TS. Nguyễn Văn Ngọc,Chỉ từ 35.000₫
Kỹ thuật gia công cơ,Lưu Đức Bình,Chỉ từ 28.000₫
Quản lý chất lượng công trình xây dựng - Kinh nghiệm quốc tế và quy định ở Việt Nam,Bùi Mạnh Hùng,Chỉ từ 15.000₫
"Quy trình pháp lý thu hồi đất, trưng...",Trần Thanh Tiến,Chỉ từ 36.000₫
Nội thất và thiết kế nội thất Tập 2,Phạm Đình Việt,210.000₫
Mối quan hệ kiến trúc và các ngành...,Tôn Thất Đại,Chỉ từ 12.000₫
Thành phố thông minh - khung quản trị...,ZAIGHAM MAHMOOD,Chỉ từ 60.000₫
Hệ thống giao thông thông minh trong...,Rodolfo I. Meneguette,Chỉ từ 48.000₫
Lập dự toán công trình bằng phần mềm Excel,Nguyễn Quốc Hùng,Chỉ từ 10.000₫
Giáo trình Quản lý dịch vụ ô tô,Nguyễn Thanh Tuấn,Chỉ từ 19.000₫
Phụ gia khoáng cho xi măng và bê tông,Lê Trung Thành,Chỉ từ 24.000₫
30 năm Olympic cơ học toàn quốc (1989 -2018); Cơ học kết cấu (1991 -02018). Đề thi - Đáp án - Thang điểm,Nguyễn Mạnh Yên,Chỉ từ 18.000₫
Giáo trình quản lý dự án đầu tư xây dựng,Phan Nhựt Duy,Chỉ từ 12.000₫
Cấp thoát nước trong nhà và công trình,Nguyễn Phương Thảo,Chỉ từ 30.000₫
Giáo trình mạch điện tử tương tự và số,Nguyễn Hoàng Mai,Chỉ từ 28.000₫
Tiêu chuẩn châu Âu - EN 1997-1:2004 (Thiết kế địa kỹ thuật - Phần 1. Các quy định chung),Viện Khoa học Công nghệ Xây dựng,Chỉ từ 16.000₫
Kỹ thuật màng lọc trong xử lý nước cấp và nước thải,PGS.TS. Trần Đức Hạ,Chỉ từ 19.000₫
Chỉnh trị sông phân lạch (sách chuyên khảo),Lương Phương Hậu,Chỉ từ 26.000₫
Bùn cát sông ngòi và bồi lắng hồ chứa,Phạm Thị Hương Lan,Chỉ từ 15.000₫
Định mức dự toán khảo sát xây dựng công trình (Ban hành kèm theo thông tư số 10/2019/TT-BXD ngày 26/12/2019 của Bộ Xây dựng),Bộ Xây Dựng,Chỉ từ 17.000₫
Hướng dẫn giải bài tập thủy lực,Nguyễn Minh Ngọc,Chỉ từ 23.000₫
Áp dụng kết cấu công trình và công nghệ tiên tiến trong xây dựng bền vững các tuyến đường bộ vùng núi,Đặng Gia Nải,Chỉ từ 13.000₫
"QCVN 16:2017/BXD Quy chuẩn kỹ thuật quốc gia về sản phẩm, hàng hóa vật liệu xây dựng",Tiêu chuẩn quốc gia,Chỉ từ 10.000₫
Nghệ thuật trang trí truyền thống trên kiến trúc phong cách Đông Dương ở Sài Gòn,Bùi Bá Nguyên Khanh,Chỉ từ 11.000₫
Kiến trúc nhà ở - Hiểu biết và thiết...,Trần Minh Tùng,Chỉ từ 33.000₫
"Quy trình pháp lý thu hồi đất, trưng...",Trần Thanh Tiến,Chỉ từ 36.000₫
Nội thất và thiết kế nội thất Tập 2,Phạm Đình Việt,210.000₫
Mối quan hệ kiến trúc và các ngành...,Tôn Thất Đại,Chỉ từ 12.000₫
Thành phố thông minh - khung quản trị...,ZAIGHAM MAHMOOD,Chỉ từ 60.000₫
Hệ thống giao thông thông minh trong...,Rodolfo I. Meneguette,Chỉ từ 48.000₫
Giám sát đánh giá dự án đầu tư xây dựng,PGS.TS. Bùi Mạnh Hùng,Chỉ từ 18.000₫
Các bài thực hành lập trình PLC S7-300 và WIN CC,Lê Xuân Hải,Chỉ từ 14.000₫
Tiêu chuẩn châu Âu - EN 1990:2002 + A1:2005/AC (Cơ sở thiết kế kết cấu - Eurocode 0 - Basis of structural design),Viện Khoa học Công nghệ Xây dựng,Chỉ từ 10.000₫
ETABS và SAP 2000 thực hành tính toán nhà cao tầng,Đặng Tỉnh,Chỉ từ 12.000₫
Các tiêu chuẩn về chuyên ngành kết cấu,Tiêu chuẩn quốc gia,Chỉ từ 12.000₫
QCVN 08:2018/BXD Quy chuẩn kỹ thuật quốc gia về công trình tàu điện ngầm,Tiêu chuẩn quốc gia,Chỉ từ 10.000₫
Kế hoạch sản xuất kinh doanh của doanh nghiệp,PGS.TS. Bùi Mạnh Hùng,Chỉ từ 21.000₫
Đấu thầu trong xây dựng,PGS.TS. Bùi Mạnh Hùng,Chỉ từ 35.000₫
Hướng dẫn trình tự giải bài toán kết cấu bằng chương trình Excel,Bạch Văn Đạt,73.500₫
Định mức dự toán lắp đặt máy và thiết bị công nghệ (Ban hành kèm theo TT số 10/2019/TT-BXD ngày 26/12/2019 của Bộ Xây dựng),Bộ Xây Dựng,Chỉ từ 20.000₫
Tính toán kết cấu hệ thanh theo phương pháp phần tử hữu hạn,Phạm Văn Đạt,Chỉ từ 28.000₫
"Tài liệu dạy, học Tin học (Chương trình đào tạo trình độ trung cấp)",Bộ Lao động - Thương binh và Xã hội,Chỉ từ 22.000₫
Mô hình trạng thái tới hạn của đất và áp lực đất lên các công trình chắn,Nguyễn Uyên,Chỉ từ 25.000₫
"Tài liệu dạy, học tiếng Anh (Chương trình đào tạo trình độ trung cấp)",Bộ Lao động - Thương binh và Xã hội,Chỉ từ 11.000₫
Địa kỹ thuật môi trường,Bùi Văn Trường,Chỉ từ 15.000₫
Xử lý nước thải sinh hoạt và công nghiệp theo công nghệ O/A (tính toán thiết kế),Trịnh Xuân Lai,83.000₫
Nhà ở xã hội - Kinh nghiệm phát triển...,Ngô Lê Minh,Chỉ từ 23.000₫
Kiến trúc nhà ở người dân tộc Chăm...,TS.KTS. Trịnh Hồng Việt,Chỉ từ 13.000₫
QCVN 01:2021/BXD Quy chuẩn xây dựng...,Tiêu chuẩn quốc gia,Chỉ từ 10.000₫
Kiến trúc nhà ở - Hiểu biết và thiết...,Trần Minh Tùng,Chỉ từ 33.000₫
Năng suất lao động trong xây dựng,Đinh Tuấn Hải,Chỉ từ 30.000₫
Vẽ kỹ thuật xây dựng,Phạm Thị Lan,103.000₫
Hoạt tải và đánh giá khả năng chịu hoạt tải công trình cầu,Nguyễn Lan,Chỉ từ 28.000₫
Cơ sở quy hoạch - kiến trúc (Dành cho sinh viên ngoài chuyên ngành quy hoạch - kiến trúc),Phạm Hùng Cường,Chỉ từ 20.000₫
Các Tiêu chuẩn về chuyên ngành Địa kỹ thuật,Tiêu chuẩn quốc gia,Chỉ từ 31.000₫
"Công nghệ xây dựng công trình thủy lợi, thủy điện",Lê Văn Hùng,Chỉ từ 21.000₫
Quy hoạch môi trường cấp quận - huyện,Nguyễn Thúy Lan Chi,Chỉ từ 11.000₫
"Tài liệu dạy, học tiếng Anh (Chương trình đào tạo trình độ cao đẳng)",Bộ Lao động - Thương binh và Xã hội,Chỉ từ 16.000₫
Design of cast-in-situ reinforced concrete one-way slabes. Thiết kế sàn sườn có bản một phương bê tông cốt thép toàn khối,TS. Nguyễn Trường Thắng,70.000₫
Phân tích và thiết kế kết cấu xây dựng bằng phần mềm SAP 2000 Version 14 tập 2,Nguyễn Lan,Chỉ từ 36.000₫
Fundamentals of building design and construction - Volume 2,Nguyễn Ngọc Linh,Chỉ từ 12.000₫
Phần mềm FB - Multipier trong thiết kế nền móng công trình,Lê Hoàng Anh,Chỉ từ 17.000₫
Sinh thái học ứng dụng trong quy hoạch và quản lý môi trường,Phạm Văn Quân,Chỉ từ 19.000₫
Nguyên lý thiết kế kiến trúc nhà ở,Trần Đình Hiếu,70.000₫
QCVN 17:2018/BXD Quy chuẩn kỹ thuật quốc gia về xây dựng và lắp đặt phương tiện quảng cáo ngoài trời,Tiêu chuẩn quốc gia,Chỉ từ 10.000₫
Msheet – Tính toán thiết kế tường cừ và cọc,Vũ Minh Tuấn,Chỉ từ 12.000₫
Giáo trình kỹ thuật tương tự 2,TS. Nguyễn Văn Vinh,Chỉ từ 14.000₫
Nhà ở xã hội - Kinh nghiệm phát triển...,Ngô Lê Minh,Chỉ từ 23.000₫
Kiến trúc nhà ở người dân tộc Chăm...,TS.KTS. Trịnh Hồng Việt,Chỉ từ 13.000₫
QCVN 01:2021/BXD Quy chuẩn xây dựng...,Tiêu chuẩn quốc gia,Chỉ từ 10.000₫
Kiến trúc nhà ở - Hiểu biết và thiết...,Trần Minh Tùng,Chỉ từ 33.000₫
Năng suất lao động trong xây dựng,Đinh Tuấn Hải,Chỉ từ 30.000₫
Ôn tập thủy văn - thủy lực công trình giao thông,Phạm Văn Thoan,Chỉ từ 34.000₫
Định mức dự toán thí nghiệm chuyên ngành xây dựng (Ban hành kèm theo thông tư số 10/2019/TT-BXD ngày 26/12/2019 của Bộ Xây dựng),Bộ Xây Dựng,Chỉ từ 19.000₫
QCVN 06:2021/BXD Quy chuẩn kỹ thuật quốc gia về an toàn cháy cho nhà và công trình,Tiêu chuẩn quốc gia,Chỉ từ 18.000₫
Độ bền kết cấu bê tông cốt thép trong các công trình ven biển,Ngô Việt Đức,Chỉ từ 12.000₫
Khoan phụt chống thấm công trình thủy lợi,Nguyễn Cảnh Thái,Chỉ từ 15.000₫
Tiêu chuẩn châu Âu - EN 1994-1-2:2005 + AC:2008 (Thiết kế kết cấu liên hợp thép và bê tông - Phần 1-2. Quy định chung - Thiết kế kết cấu chịu lửa),Viện Khoa học Công nghệ Xây dựng,Chỉ từ 11.000₫
Kết cấu đặc biệt bằng bê tông cốt thép,Nguyễn Lê Ninh,Chỉ từ 25.000₫
Hướng dẫn thiết kế đồ án môn học cấp thoát nước trong nhà và công trình,Nguyễn Phương Thảo,Chỉ từ 10.000₫
Bài tập và hệ thống bảng tra thủy văn công trình giao thông - Tập 4. Phương pháp tính toán thủy văn,Phạm Văn Thoan,Chỉ từ 23.000₫
Giáo trình Access 2010,Võ Đình Bảy,Chỉ từ 13.000₫
Bài tập nhập môn hệ cơ sở dữ liệu,Nguyễn Thế Dũng,Chỉ từ 13.000₫
Công nghệ mới trong nghiên cứu và quản lý cửa sông và bờ biển,Nguyễn Trung Việt,Chỉ từ 12.000₫
"Tài liệu dạy, học Giáo dục Quốc phòng và An ninh (Chương trình đào tạo trình độ trung cấp)",Bộ Lao động - Thương binh và Xã hội,Chỉ từ 12.000₫
"Tiêu chuẩn châu Âu - EN 1998-1:2004 + A1:2013 (Thiết kế công trình chịu động đất - Phần 1- Quy định chung, tác động động đất và quy định đối với kết cấu nhà)",Viện Khoa học Công nghệ Xây dựng,Chỉ từ 21.000₫
Giáo trình lập trình Android,Lê Hoàng Sơn,Chỉ từ 11.000₫
Đánh giá rủi ro thiên tai,Phạm Thị Hương Lan,Chỉ từ 14.000₫
Nhà ở xã hội - Kinh nghiệm phát triển...,Ngô Lê Minh,Chỉ từ 23.000₫
Kiến trúc nhà ở người dân tộc Chăm...,TS.KTS. Trịnh Hồng Việt,Chỉ từ 13.000₫
QCVN 01:2021/BXD Quy chuẩn xây dựng...,Tiêu chuẩn quốc gia,Chỉ từ 10.000₫
Kiến trúc nhà ở - Hiểu biết và thiết...,Trần Minh Tùng,Chỉ từ 33.000₫
Năng suất lao động trong xây dựng,Đinh Tuấn Hải,Chỉ từ 30.000₫
Phương pháp tính,Nguyễn Thế Hùng,Chỉ từ 29.000₫
CIVIL 3D 2013 Thiết kế kỹ thuật hạ tầng đô thị. Tập 2: Thiết kế đường nút giao thông,Phạm Ngọc Sáu,Chỉ từ 36.000₫
Thiết kế kết cấu thép bể và bồn chứa áp lực thấp,Nguyễn Hồng Sơn,Chỉ từ 23.000₫
"Tài liệu dạy, học Pháp luật (Chương trình đào tạo trình độ trung cấp)",Bộ Lao động - Thương binh và Xã hội,Chỉ từ 10.000₫
Tin học ứng dụng trong tính toán kết cấu công trình,Đặng Tỉnh,Chỉ từ 14.000₫
Thiết kế kết cấu thép theo quy phạm Hoa Kỳ AISC 360-10,Đoàn Định Kiến,135.000₫
Giáo trình lập trình cơ sở,Lê Đắc Nhường,127.000₫
Tiêu chuẩn châu Âu - EN1998-3:2005 + AC:2013 (Thiết kế công trình chịu động đất - Phần 3 - Đánh giá và gia cường kết cấu nhà),Viện Khoa học Công nghệ Xây dựng,Chỉ từ 10.000₫
Cơ sở kỹ thuật năng lượng tái tạo,Phan Quang Văn,Chỉ từ 17.000₫
VE - Phương pháp nâng cao chất lượng và tiết kiệm chi phí xây dựng,Lưu Trường Văn,Chỉ từ 17.000₫
"Tiêu chuẩn châu Âu - EN 1996-1-1:2005 + AC:2009 (Thiết kế kết cấu gạch đá - Phần 1.1: Quy định chung cho kết cấu gạch đá và gạch, đá cốt thép)",Viện Khoa học Công nghệ Xây dựng,Chỉ từ 11.000₫
Các tiêu chuẩn về kết cấu bê tông và bê tông cốt thép,Tiêu chuẩn quốc gia,116.000₫
