title,author,price
"Thủy lực đại cương - Tóm tắt lý thuyết bài tập, số liệu tra cứu",Nguyễn Tài,Chỉ từ 34.000₫
Đầu tư bất động sản,Gary W. Eldred,Chỉ từ 71.000₫
Kiến trúc nhà ở - Hiểu biết và thiết...,Trần Minh Tùng,Chỉ từ 33.000₫
Quy hoạch đô thị (Giáo trình dành cho...,Phạm Hùng Cường,Chỉ từ 15.000₫
Thiết kế và thi công cầu bê tông chất...,Phạm Duy Hòa,Chỉ từ 15.000₫
Thành phố thông minh - khung quản trị...,ZAIGHAM MAHMOOD,Chỉ từ 60.000₫
Thủy lực dòng chảy hở,Nguyễn Cảnh Cầm,Chỉ từ 16.000₫
Phân tích kết cấu nhà nhiều tầng,PGS.TS. Nguyễn Tiến Chương,91.000₫
Môi trường trong quy hoạch xây dựng,Vũ Trọng Thắng - ĐHKTHN,113.400₫
ANSYS Phân tích kết cấu công trình thủy lợi thủy điện - Tập 1: Các bài toán cơ bản,Vũ Hoàng Hưng,Chỉ từ 31.000₫
Trắc địa đường hầm và công trình ngầm,Nguyễn Quang Tác,Chỉ từ 17.000₫
Thủy lực sông,Nguyễn Tài,Chỉ từ 21.000₫
Mất ổn định khí động do kích động xoáy và galloping đối với công trình xây dựng,Nguyễn Võ Thông,80.000₫
Ma sát học và vật liệu mới trong cơ khí,Bùi Lê Gôn,96.000₫
Giáo trình cây xanh đô thị,Phạm Anh Dũng,Chỉ từ 11.000₫
Hướng dẫn sử dụng máy đo đạc xây dựng công trình,Phạm Văn Chuyên,Chỉ từ 16.000₫
Tính toán mối nối hàn có xét đến sự tập trung ứng suất,Phạm Huy Chính,Chỉ từ 16.000₫
Định mức dự toán chuyên ngành vệ sinh môi trường đô thị - Tập 1,Bộ Xây Dựng,7.500₫
Tính kết cấu bằng phần mềm ANSYS version 10.0,Vũ Quốc Anh,Chỉ từ 21.000₫
Sổ tay 1269 cơ cấu máy và dụng cụ,Nguyễn Văn Huyền,Chỉ từ 27.000₫
Máy và thiết bị sản xuất vật liệu và cấu kiện xây dựng,Vũ Liêm Chính,Chỉ từ 37.000₫
Cơ học vật liệu và kết cấu composite,Trần Minh Tú,148.000₫
Đầu tư bất động sản,Gary W. Eldred,Chỉ từ 71.000₫
Kiến trúc nhà ở - Hiểu biết và thiết...,Trần Minh Tùng,Chỉ từ 33.000₫
Quy hoạch đô thị (Giáo trình dành cho...,Phạm Hùng Cường,Chỉ từ 15.000₫
Thiết kế và thi công cầu bê tông chất...,Phạm Duy Hòa,Chỉ từ 15.000₫
Thành phố thông minh - khung quản trị...,ZAIGHAM MAHMOOD,Chỉ từ 60.000₫
Hồ đô thị - Quản lý kỹ thuật và kiểm soát ô nhiễm,Trần Đức Hạ,169.000₫
"Tiêu chuẩn châu Âu - EN 1991-1-1:2002 + AC:2009 (Tác động lên kết cấu - Phần 1-1. Tác động chung - Trọng lượng thể tích, trọng lượng bản thân và hoạt tải đối với công trình)",Viện Khoa học Công nghệ Xây dựng,34.000₫
Các tiêu chuẩn Việt Nam về quy hoạch xây dựng (Gồm 7 TCVN hiện hành về quy hoạch xây dựng),Tiêu chuẩn quốc gia,27.500₫
Thi công chế tạo kết cấu bêtông cốt thép,Phạm Huy Chính,Chỉ từ 16.000₫
Tính kết cấu đặc biệt theo phương pháp phần tử hữu hạn,Võ Như Cầu,24.500₫
Kiến trúc năng lượng và môi trường,Ngô Thám,Chỉ từ 16.000₫
Máy thiết bị và hệ thống nghiền mịn,Vũ Liêm Chính,Chỉ từ 19.000₫
Lắp ghép công trình dân dụng và công nghiệp,Lê Văn Kiểm,Chỉ từ 51.000₫
"Tiêu chuẩn châu Âu - EN 1998-4:2006 (Thiết kế công trình chịu động đất - Phần 4 - Silo, bể chứa và đường ống)",Viện Khoa học Công nghệ Xây dựng,Chỉ từ 10.000₫
Thi công móng sâu,Phạm Huy Chính,55.300₫
Giáo trình bảo dưỡng và sửa chữa đường ô tô,Lê Văn Bách,107.000₫
Giáo trình kiểm tra chất lượng mối hàn theo tiêu chuẩn quốc tế,Trường Cao đẳng nghề Việt Xô số 1,Chỉ từ 10.000₫
Ứng dụng MS PROJECT 2007 trong lập tiến độ và quản lý dự án xây dựng,Lương Đức Long,Chỉ từ 21.000₫
Nguyên lý thiết kế công trình kiến trúc công cộng,Tạ Trường Xuân,53.000₫
Tính toán mạng lưới phân phối nước và phân tính nước va,Trịnh Xuân Lai,35.000₫
Giáo trình sửa chữa và bảo dưỡng hệ thống điện máy thi công xây dựng,Trường Cao đẳng nghề Việt Xô số 1,Chỉ từ 10.000₫
Thiết kế và thi công cầu bê tông chất...,Phạm Duy Hòa,Chỉ từ 15.000₫
Kiến trúc nhà ở người dân tộc Chăm...,TS.KTS. Trịnh Hồng Việt,Chỉ từ 13.000₫
Hệ thống giao thông thông minh trong...,Rodolfo I. Meneguette,Chỉ từ 48.000₫
Nội thất và thiết kế nội thất Tập 2,Phạm Đình Việt,210.000₫
Năng suất lao động trong xây dựng,Đinh Tuấn Hải,Chỉ từ 30.000₫
Thạch luận công trình,Nguyễn Uyên,Chỉ từ 28.000₫
Kiến trúc Đông Dương,Lê Minh Sơn,Chỉ từ 24.000₫
Kỹ thuật làm nhà theo phong tục và văn hoá xây dựng Phương Đông,Nguyễn Tiến Đích,Chỉ từ 35.000₫
Đất đá xây dựng và phương pháp cải tạo,Đỗ Minh Toàn,Chỉ từ 23.000₫
Thấm và ăn mòn kết cấu bê tông cốt thép,Nguyễn Viết Trung,Chỉ từ 22.000₫
Ứng dụng phương pháp phần tử hữu hạn bằng phần mềm MATHCAD,Lưu Nguyễn Nam Hải,68.600₫
Các bảng tra để tính toán bản đàn hồi hình chữ nhật,Lê Mạnh Lân,8.000₫
Hướng dẫn thiết kế đồ án mạng lưới cấp nước,Nguyễn Thị Hồng,21.000₫
Máy xây dựng,Vũ Minh Khương,Chỉ từ 22.000₫
Hướng dẫn sử dụng AutoCAD 2012,Đào Xuân Lộc,Chỉ từ 29.000₫
Bảo tàng hoá di tích,Nguyễn Thịnh,Chỉ từ 24.000₫
Giáo trình cơ sở thiết kế cấu tạo công trình ngầm,Trần Tuấn Minh,Chỉ từ 14.000₫
"Hướng dẫn xây dựng, sửa chữa nhà và công trình thấp tầng trong vùng động đất",Nguyễn Võ Thông,36.400₫
Thí nghiệm vật liệu xây dựng,Nguyễn Duy Hiếu,64.000₫
Tiêu chuẩn châu Âu - EN 1994-1-1:2004 + AC:2009 (Thiết kế kết cấu liên hợp thép và bê tông - Phần 1-1. Quy định chung và quy định cho nhà),Viện Khoa học Công nghệ Xây dựng,80.000₫
Tiêu chuẩn châu Âu - EN 1992-1-2:2004 + AC:2008 (Thiết kế kết cấu bê tông - Phần 1-2. Quy định chung - Thiết kế kết cấu chịu lửa),Viện Khoa học Công nghệ Xây dựng,68.000₫
Quy trình pháp lý đầu tư phát triển...,Trần Thanh Tiến,Chỉ từ 45.000₫
Thiết kế và thi công cầu bê tông chất...,Phạm Duy Hòa,Chỉ từ 15.000₫
Kiến trúc nhà ở người dân tộc Chăm...,TS.KTS. Trịnh Hồng Việt,Chỉ từ 13.000₫
Hệ thống giao thông thông minh trong...,Rodolfo I. Meneguette,Chỉ từ 48.000₫
Nội thất và thiết kế nội thất Tập 2,Phạm Đình Việt,210.000₫
Năng suất lao động trong xây dựng,Đinh Tuấn Hải,Chỉ từ 30.000₫
Các giải pháp thiết kế công trình xanh ở Việt Nam,Phạm Ngọc Đăng,Chỉ từ 43.000₫
Thiết kế và thi công tường cừ,Vũ Minh Tuấn,Chỉ từ 16.000₫
Hướng dẫn giải bài tập cơ học cơ sở - T3: Động lực học,Đặng Quốc Lương,Chỉ từ 14.000₫
Các bảng tính thủy lực,Bộ môn thủy lực - ĐH thủy lợi,24.500₫
Thiết kế điển hình ký túc xá sinh viên,Bộ Xây Dựng,26.600₫
Sổ tay tham khảo phong cách Việt trong trang trí nội thất,Võ Thị Thu Thủy,38.500₫
Các giải pháp thiết kế công trình xanh ở Việt Nam,Phạm Ngọc Đăng,Chỉ từ 41.000₫
Phương pháp thiết kế tuyến Clothoid cho đường ôtô,Nguyễn Xuân Vinh,Chỉ từ 20.000₫
Thiết kế bến cảng du thuyền,Vũ Minh Tuấn,60.200₫
Rèn luyện cơ sở vẽ ký hoạ cho thiếu nhi,Đặng Thái Hoàng,10.500₫
Thiết kế chiếu sáng nghệ thuật các công trình công công và không gian đô thị,Nguyễn Đức Thiềm,Chỉ từ 20.000₫
Thực tập và bài tập địa chất công trình,Nguyễn Uyên,Chỉ từ 32.000₫
Thiết kế đường sắt - Tập 2,Phạm Văn Ký,139.000₫
Trắc địa đại cương (ĐHXD),Phạm Văn Chuyên,Chỉ từ 21.000₫
Tiêu chuẩn châu Âu - EN 1991-1-2:2002 + AC:2013 (Tác động lên kết cấu - Phần 1-2. Tác động chung - Tác động lên kết cấu khi tiếp xúc với lửa),Viện Khoa học Công nghệ Xây dựng,46.000₫
Thiết bị cơ điện lạnh,Đinh Văn Thắng,Chỉ từ 13.000₫
Quy trình pháp lý đầu tư phát triển...,Trần Thanh Tiến,Chỉ từ 45.000₫
Thiết kế và thi công cầu bê tông chất...,Phạm Duy Hòa,Chỉ từ 15.000₫
Kiến trúc nhà ở người dân tộc Chăm...,TS.KTS. Trịnh Hồng Việt,Chỉ từ 13.000₫
Hệ thống giao thông thông minh trong...,Rodolfo I. Meneguette,Chỉ từ 48.000₫
Nội thất và thiết kế nội thất Tập 2,Phạm Đình Việt,210.000₫
101 thắc mắc và giải đáp khi sử dụng chương trình Microsoft Project trong xây dựng,PGS.TS. Bùi Mạnh Hùng,Chỉ từ 10.000₫
Hướng dẫn sử dụng phần mềm phân tích và thiết kế kết cấu xây dựng KCW 2010- Version 5.00,Nguyễn Mạnh Hiến,Chỉ từ 13.000₫
Công trình bến cảng,Phạm Văn Giáp,87.500₫
Staad.Pro 2002 phần mềm tính kết cấu chuyên dụng,Ngô Minh Đức,60.200₫
Bảng thông số giá ca máy và thiết bị thi công,Bộ Xây Dựng,Chỉ từ 10.000₫
Kiểm định vật liệu trong xây dựng,Ngô Tấn Dược,46.200₫
Thiết kế kết cấu nhịp cầu dầm Super-T theo tiêu chuẩn 22TCN 272-05,Nguyễn Viết Trung,74.200₫
Thủy văn công trình nâng cao - Quyển 1: Biến dạng lòng sông dưới cầu,Trần Đình Nghiên,Chỉ từ 11.000₫
TCVN 5593:2012 Công tác thi công tòa nhà - Sai số hình học cho phép,Tiêu chuẩn quốc gia,Chỉ từ 10.000₫
Thiết bị FACTS trong hệ thống điện,Hồ Đắc Lộc,Chỉ từ 11.000₫
Hướng dẫn đồ án kiến trúc công nghiệp,Tạ Quỳnh Hoa,99.000₫
Hướng dẫn đồ án thi công cầu,Trần Quốc Ca,Chỉ từ 14.000₫
Giáo trình sức bền vật liệu (BXD),Bộ Xây Dựng,Chỉ từ 16.000₫
Những vấn đề chung và mố trụ cầu,Nguyễn Như Khải,29.400₫
Nguyên lý thiết kế khách sạn,Tạ Trường Xuân,Chỉ từ 15.000₫
Công nghệ bê tông nhẹ cốt liệu rỗng chất lượng cao,Nguyễn Duy Hiếu,63.000₫
Quy trình pháp lý đầu tư phát triển...,Trần Thanh Tiến,Chỉ từ 45.000₫
Thiết kế và thi công cầu bê tông chất...,Phạm Duy Hòa,Chỉ từ 15.000₫
Kiến trúc nhà ở người dân tộc Chăm...,TS.KTS. Trịnh Hồng Việt,Chỉ từ 13.000₫
Hệ thống giao thông thông minh trong...,Rodolfo I. Meneguette,Chỉ từ 48.000₫
Nội thất và thiết kế nội thất Tập 2,Phạm Đình Việt,210.000₫
Địa kỹ thuật với phát triển công trình đô thị,Nguyễn Bá Kế,Chỉ từ 28.000₫
Thiết kế biện pháp kỹ thuật thi công lắp ghép nhà công nghiệp 1 tầng,Nguyễn Đình Thám,24.500₫
TCVN 4055:2012 Tổ chức thi công,Tiêu chuẩn quốc gia,Chỉ từ 10.000₫
Kỹ thuật đo lường điện (tập 3),Đỗ Đình Đức,Chỉ từ 18.000₫
Tải trọng và tác động - Tiêu chuẩn thiết kế,Tiêu chuẩn quốc gia,44.000₫
Máy bơm và các thiết bị cấp thoát nước,Lê Dung,42.000₫
Quy phạm thiết kế thi công & nghiệm thu công tác đất & công trình bằng đất,Tiêu chuẩn quốc gia,18.000₫
"Đồ hoạ kiến trúc, vẽ kỹ thuật kiến trúc (Tập 1)",Nguyễn Hữu Trí,Chỉ từ 18.000₫
Công nghệ thi công kết cấu nhịp cầu,Phạm Văn Thoan,Chỉ từ 32.000₫
Phần mềm SLOPE/W ứng dụng vào tính toán ổn định trượt sâu công trình,Đỗ Văn Đệ,Chỉ từ 17.000₫
Cẩm nang hướng dẫn sử dụng kính trong xây dựng,Trần Quốc Thái,Chỉ từ 16.000₫
Giáo trình cơ sở mô hình hóa chất lượng nước mặt,Đào Nguyên Khôi,118.000₫
Tính toán đập bê tông trọng lực và đập vòm,Nguyễn Quang Hùng,Chỉ từ 15.000₫
Sổ tay thiết kế đường ôtô - Tập 2,Nguyễn Xuân Trục,88.200₫
Bài tập sức bền vật liệu,Phạm Đức Phung,74.200₫
Thiết kế cầu treo dây võng,Nguyễn Viết Trung,Chỉ từ 19.000₫
Quy trình pháp lý đầu tư phát triển...,Trần Thanh Tiến,Chỉ từ 45.000₫
Thiết kế và thi công cầu bê tông chất...,Phạm Duy Hòa,Chỉ từ 15.000₫
Kiến trúc nhà ở người dân tộc Chăm...,TS.KTS. Trịnh Hồng Việt,Chỉ từ 13.000₫
Hệ thống giao thông thông minh trong...,Rodolfo I. Meneguette,Chỉ từ 48.000₫
Nội thất và thiết kế nội thất Tập 2,Phạm Đình Việt,210.000₫
Tính hệ thanh theo phương pháp ma trận,Võ Như Cầu,Chỉ từ 19.000₫
Khảo sát địa chất để thiết kế các loại công trình,Nguyễn Uyên,Chỉ từ 33.000₫
Cơ học đất (GT dùng cho SV ngành xây dựng cầu đường),Bùi Anh Định,Chỉ từ 27.000₫
Đê biển và kè mái nghiêng,Thiều Quang Tuấn,92.000₫
Phân tích kết cấu cầu dây văng theo các giai đoạn bằng chương trình Midas 2006,Nguyễn Viết Trung,Chỉ từ 15.000₫
Địa chất công trình,Nguyễn Uyên,Chỉ từ 24.000₫
Tính toán thiết kế các kết cấu mặt đường,Phạm Cao Thăng,Chỉ từ 19.000₫
"Giao thông hành khách công cộng tốc độ cao, sức chở lớn trong phát triển đô thị",Hồ Ngọc Hùng,66.000₫
Sổ tay thi công công trình cấp thoát nước,Lê Mục Đích,Chỉ từ 26.000₫
Thiết kế công trình hạ tầng đô thị và giao thông công cộng thành phố,Nguyễn Xuân Vinh,101.500₫
Đề bài và hướng dẫn giải bài tập lớn sức bền vật liệu cơ học kết cấu,Lều Mộc Lan,Chỉ từ 10.000₫
Thiết kế kết cấu nhà chịu tác động của nổ sự cố,Nguyễn Hồng Sơn,Chỉ từ 19.000₫
Chuẩn bị kỹ thuật khu đất xây dựng,Phạm Trọng Mạnh,Chỉ từ 19.000₫
Nghiệp vụ định giá xây dựng,PGS.TS. Bùi Mạnh Hùng,Chỉ từ 40.000₫
Mười cuốn sách về kiến trúc,Lê Phục Quốc,155.000₫
Ứng dụng chương trình RM trong phân tích tính toán kết cấu cầu (Tập 2),Nguyễn Viết Trung,Chỉ từ 27.000₫
Quy trình pháp lý đầu tư phát triển...,Trần Thanh Tiến,Chỉ từ 45.000₫
Thiết kế và thi công cầu bê tông chất...,Phạm Duy Hòa,Chỉ từ 15.000₫
Kiến trúc nhà ở người dân tộc Chăm...,TS.KTS. Trịnh Hồng Việt,Chỉ từ 13.000₫
Hệ thống giao thông thông minh trong...,Rodolfo I. Meneguette,Chỉ từ 48.000₫
Nội thất và thiết kế nội thất Tập 2,Phạm Đình Việt,210.000₫
Khoáng thạch với vật liệu xây dựng,Trần Thượng Bình,Chỉ từ 18.000₫
Động lực học công trình,Đỗ Kiến Quốc,105.000₫
Cơ sở thiết kế và thi công công trình ngầm đô thị,Nguyễn Đức Nguôn,Chỉ từ 40.000₫
TCVN 9360 - 2012 Quy trình kỹ thuật xác định độ lún công trình dân dụng và công nghiệp bằng phương pháp đo cao hình học,Tiêu chuẩn quốc gia,Chỉ từ 10.000₫
Giáo trình cấu tạo máy lu,Trường Cao đẳng nghề Việt Xô số 1,Chỉ từ 10.000₫
Nguyên lý thiết kế sân vận động,Tạ Trường Xuân,Chỉ từ 12.000₫
Tính toán thiết kế công trình ngầm,Trần Thanh Giám,Chỉ từ 31.000₫
Cơ học kết cấu (Tập 2),TS. Nguyễn Văn Phượng,Chỉ từ 29.000₫
Cơ sở sinh thái cảnh quan trong kiến trúc cảnh quan và quy hoạch sử dụng đất bền vững,Nguyễn An Thịnh,Chỉ từ 11.000₫
Tin học ứng dụng cầu đường,Phạm Văn Thoan,Chỉ từ 20.000₫
Các kỹ thuật mới cải tạo và bảo vệ môi trường đất trong xây dựng,Nguyễn Ngọc Bích,Chỉ từ 29.000₫
Quy hoạch vùng,Trần Trọng Hanh,Chỉ từ 29.000₫
Hệ thống bài tập và đồ án kiến trúc,Đại học Kiến trúc Hà Nội,81.200₫
Móng trên các loại đất đá,Nguyễn Uyên,48.300₫
Sổ tay,Lê Mục Đích,Chỉ từ 26.000₫
Giáo trình sức bền vật liệu,Trần Văn Liên,Chỉ từ 27.000₫
Năng suất lao động trong xây dựng,Đinh Tuấn Hải,Chỉ từ 30.000₫
Thiết kế liên kết trong kết cấu thép...,TS. Trần Văn Phúc,Chỉ từ 16.000₫
Thiết kế và thi công cầu bê tông chất...,Phạm Duy Hòa,Chỉ từ 15.000₫
Vẽ kỹ thuật cơ bản,Vũ Tiến Đạt,Chỉ từ 10.000₫
QCVN 01:2021/BXD Quy chuẩn xây dựng...,Tiêu chuẩn quốc gia,Chỉ từ 10.000₫
Kỹ thuật thi công dưới nước,Phạm Huy Chính,Chỉ từ 14.000₫
Giáo trình kỹ thuật gia công cơ khí,Bùi Lê Gôn,Chỉ từ 19.000₫
Bảo hộ lao động trong xây dựng,PGS.TS. Bùi Mạnh Hùng,Chỉ từ 32.000₫
Giáo trình thủy lực cấp thoát nước,Nguyễn Văn Sứng,35.000₫
Đánh giá sản xuất sạch hơn,Lê Thanh Hải,138.000₫
TCVN 4454:2012 Quy hoạch xây dựng nông thôn - Tiêu chuẩn thiết kế,Tiêu chuẩn quốc gia,Chỉ từ 10.000₫
Đổi mới trong nghệ thuật kiến trúc,Đặng Thái Hoàng,29.400₫
Nhập môn phương pháp phần tử hữu hạn ứng dụng tính toán kết cấu bằng chương trình ngôn ngữ PASCAL,Trần Đức Trung,14.000₫
Nền và móng công trình cầu đường,Bùi Anh Định,76.300₫
Tấm lợp kim loại,Hoàng Kim Vũ,Chỉ từ 10.000₫
Bê tông tự đầm,Nguyễn Viết Trung,38.500₫
Giáo trình mô đun 25: Sửa chữa và bảo dưỡng hệ thống thủy lực khí nén nghề sữa chữa máy thi công xây dựng,Trường Cao đẳng nghề Việt Xô số 1,Chỉ từ 13.000₫
Microsoft Project 2010 và ứng dụng trong Quản lý dự án xây dựng,Nguyễn Thị Hải Như,Chỉ từ 12.000₫
Lịch sử design,Lê Huy Văn,88.000₫
Sức bền vật liệu - Các bài tập lớn tính toán - thiết kế,Tô Văn Tấn,Chỉ từ 17.000₫
Các tiêu chuẩn về công trình thể thao (TCVN 4205; 4206; 4529; 4603; 9365: 2012),Tiêu chuẩn quốc gia,Chỉ từ 14.000₫
Thiết kế liên kết trong kết cấu thép...,TS. Trần Văn Phúc,Chỉ từ 16.000₫
Thiết kế và thi công cầu bê tông chất...,Phạm Duy Hòa,Chỉ từ 15.000₫
Vẽ kỹ thuật cơ bản,Vũ Tiến Đạt,Chỉ từ 10.000₫
QCVN 01:2021/BXD Quy chuẩn xây dựng...,Tiêu chuẩn quốc gia,Chỉ từ 10.000₫
Thành phố thông minh - khung quản trị...,ZAIGHAM MAHMOOD,Chỉ từ 60.000₫
Bài tập lý thuyết mạch điện - Quyển 1,Đoàn Đức Tùng,92.000₫
Giáo trình kỹ thuật cốt thép biết hàn theo phương pháp môđun (BXD),Bộ Xây Dựng,38.500₫
Kỹ thuật đo lường điện và các thuật toán đo phi điện,Đặng Văn Chí,152.000₫
Giáo trình sử dụng máy xúc,Trường Cao đẳng nghề Việt Xô số 1,Chỉ từ 17.000₫
Trắc địa (Sử dụng trong trường kỹ thuật),Vũ Thặng,Chỉ từ 29.000₫
Thi công cầu,Nguyễn Quốc Hùng,Chỉ từ 16.000₫
Thủy lực công trình thoát nước,Trần Đình Nghiên,Chỉ từ 20.000₫
Đo lường và điều khiển dùng máy tính,Hồ Đắc Lộc,Chỉ từ 14.000₫
Địa chất công trình,Nguyễn Hồng Đức,116.000₫
Vật liệu kỹ thuật,Dương Tử Tiên,Chỉ từ 16.000₫
Trắc địa cơ sở - Tập II,Nguyễn Trọng San,66.500₫
Phương pháp quy hoạch thực nghiệm trong thiết kế tối ưu TPBT,TS. Phạm Toàn Đức,59.000₫
Tổ chức thi công các kết cấu bêtông và bêtông cốt thép,Nguyễn Văn Phiêu,Chỉ từ 31.000₫
QCVN 07:2016/BXD về các công trình hạ tầng kỹ thuật,Bộ Xây Dựng,Chỉ từ 11.000₫
Giáo trình kết cấu nhà bê tông cốt thép,Trần Ngọc Long,Chỉ từ 19.000₫
Công nghiệp dầu khí và quy hoạch công trình biển,Đinh Quang Cường,Chỉ từ 24.000₫
Thiết kế liên kết trong kết cấu thép...,TS. Trần Văn Phúc,Chỉ từ 16.000₫
Thiết kế và thi công cầu bê tông chất...,Phạm Duy Hòa,Chỉ từ 15.000₫
Vẽ kỹ thuật cơ bản,Vũ Tiến Đạt,Chỉ từ 10.000₫
QCVN 01:2021/BXD Quy chuẩn xây dựng...,Tiêu chuẩn quốc gia,Chỉ từ 10.000₫
Thành phố thông minh - khung quản trị...,ZAIGHAM MAHMOOD,Chỉ từ 60.000₫
Giáo trình quản lý tri thức,Phạm Quốc Trung,100.000₫
Giáo trình máy điện,Bộ Xây Dựng,Chỉ từ 25.000₫
Cách sử dụng ngôn ngữ ma trận trong lý thuyết tính hệ thanh,Lều Thọ Trình,Chỉ từ 12.000₫
Giáo trình pháp luật về xây dựng,PGS.TS. Bùi Mạnh Hùng,46.900₫
Lý thuyết và hỏi đáp về tổ chức và lập tiến độ thi công,Ngô Quang Trường,Chỉ từ 28.000₫
Chuẩn bị kỹ thuật đất đai xây dựng đô thị,Hồ Ngọc Hùng,Chỉ từ 14.000₫
Kết cấu bê tông ứng suất trước,PGS.TS. Nguyễn Tiến Chương,Chỉ từ 29.000₫
Địa kỹ thuật (có ví dụ và bài tập),Trần Thanh Giám,Chỉ từ 23.000₫
Giáo trình cấp thoát nước (ĐHKTHN),Hoàng Huệ,Chỉ từ 20.000₫
Định mức dự toán xây dựng công trình - Phần lắp đặt,Bộ Xây Dựng,48.300₫
Đất xây dựng và phương pháp gia cố nền đất,Trần Thanh Giám,Chỉ từ 29.000₫
Trắc địa công trình đường hầm,Phan Văn Hiến,Chỉ từ 17.000₫
Ô nhiễm môi trường Việt Nam,Đinh Văn Châu,126.000₫
Thép xây dựng,Phạm Huy Chính,Chỉ từ 14.000₫
Sổ tay thiết kế đường ôtô - Tập 3,Nguyễn Xuân Trục,118.000₫
Tính toán tiết diện cột bêtông cốt thép,Nguyễn Đình Cống,Chỉ từ 17.000₫
Năng suất lao động trong xây dựng,Đinh Tuấn Hải,Chỉ từ 30.000₫
Thiết kế liên kết trong kết cấu thép...,TS. Trần Văn Phúc,Chỉ từ 16.000₫
Thiết kế và thi công cầu bê tông chất...,Phạm Duy Hòa,Chỉ từ 15.000₫
Vẽ kỹ thuật cơ bản,Vũ Tiến Đạt,Chỉ từ 10.000₫
QCVN 01:2021/BXD Quy chuẩn xây dựng...,Tiêu chuẩn quốc gia,Chỉ từ 10.000₫
Giáo trình cơ học lý thuyết (BXD-Hệ cao đẳng),Bộ Xây Dựng,Chỉ từ 21.000₫
Các công nghệ thi công cầu,Nguyễn Viết Trung,74.900₫
Tính toán thực hành nền móng công trình dân dụng và công nghiệp,Vương Văn Thành,Chỉ từ 31.000₫
"Công trình biển. Phần 2: Thiết kế tường bến cầu tàu, trụ độc lập",Nguyễn Hữu Đẩu,Chỉ từ 12.000₫
Giáo trình chế tạo thiết bị cơ khí - Tập I,Lê Văn Hiến,Chỉ từ 22.000₫
Quy hoạch và xử lý số liệu thực nghiệm,Nguyễn Doãn Ý,Chỉ từ 15.000₫
Các bảng tính toán thủy lực,Nguyễn Thị Hồng,34.300₫
Lắp ráp dầm thép liên kết bằng bu lông cường độ cao,Phạm Huy Chính,Chỉ từ 13.000₫
Cơ học đá ứng dụng,Nguyễn Uyên,Chỉ từ 25.000₫
Phần mềm Plaxis 3D FOUNDATION ứng dụng vào tính toán móng và công trình ngầm,Đỗ Văn Đệ,Chỉ từ 16.000₫
Sổ tay giám sát thi công công trình xây dựng,Nguyễn Đăng Sơn,50.400₫
Tối ưu hóa thiết kế để hạ giá thành nhà ở chung cư đô thị,Tổng Công ty tư vấn Xây dựng Việt Nam,Chỉ từ 13.000₫
Quy hoạch cảng,Pham Văn Giáp,Chỉ từ 51.000₫
Giáo trình chi tiết và cơ cấu máy,Nguyễn Trọng Hùng,121.800₫
Thiết kế điển hình khu trung tâm văn hoá thể thao cấp xã,Bộ Xây Dựng,19.600₫
Hoàn thiện kỹ thuật khu đất xây dựng đô thị,Trần Thị Hường,Chỉ từ 18.000₫
Thiết kế liên kết trong kết cấu thép...,TS. Trần Văn Phúc,Chỉ từ 16.000₫
Thiết kế và thi công cầu bê tông chất...,Phạm Duy Hòa,Chỉ từ 15.000₫
Vẽ kỹ thuật cơ bản,Vũ Tiến Đạt,Chỉ từ 10.000₫
QCVN 01:2021/BXD Quy chuẩn xây dựng...,Tiêu chuẩn quốc gia,Chỉ từ 10.000₫
Thành phố thông minh - khung quản trị...,ZAIGHAM MAHMOOD,Chỉ từ 60.000₫
Hướng dẫn giải bài tập cơ học cơ sở - tập 1- Tĩnh học,Đặng Quốc Lương,Chỉ từ 11.000₫
Giáo trình cơ học xây dựng (BXD),Bộ Xây Dựng,58.800₫
Giáo trình lý thuyết tài chính tiền tệ (BXD-Hệ cao đẳng),Bộ Xây Dựng,Chỉ từ 10.000₫
Công nghệ thi công móng - mố trụ - tháp cầu,Phạm Văn Thoan,Chỉ từ 28.000₫
Quy hoạch chiều cao,Trần Thị Vân,37.100₫
Thiết kế trưng bày di sản lý thuyết và thực hành,Nguyễn Thịnh,43.400₫
Tính toán cấu kiện bê tông cốt thép,Nguyễn Hữu Lân,Chỉ từ 15.000₫
Quản lý đô thị,Phạm Trọng Mạnh,42.000₫
Giáo trình vật liệu cơ khí,Phạm Đình Sùng,169.000₫
