title,author,price
Phương pháp số chương trình Plaxis 3D và Udec,Nguyễn Quang Phích,62.000₫
"Tính toán phân tích trượt lở đất đá, giải pháp đề phòng và giảm nhẹ tác hại",Phan Trường Phiệt,Chỉ từ 33.000₫
Cầu thép bê tông cốt thép liên hợp,Nguyễn Như Khải,42.000₫
TCVN 9080-6:2012. Vữa bền hoá gốc polyme - Phương pháp thử - Phần 6: Xác định độ hấp thụ nước - Chemical-resistant polymer mortars - Test methods - Part 6: Determination of water absorption,Tiêu chuẩn quốc gia,Chỉ từ 10.000₫
Nâng Tầm Tiêu Chuẩn An Toàn Người Bệnh,MIMS,Chỉ từ 10.000₫
Tác động của di cư nội địa tới đời sống người cao tuổi Việt Nam (Sách chuyên khảo),Trần Thị Trúc,Chỉ từ 15.000₫
Sổ tay hướng dẫn quy hoạch mạng lưới...,Phan Tiến Tâm,Chỉ từ 10.000₫
Quy hoạch đô thị (Giáo trình dành cho...,Phạm Hùng Cường,Chỉ từ 15.000₫
Hệ thống giao thông thông minh trong...,Rodolfo I. Meneguette,Chỉ từ 48.000₫
Nhà ở xã hội - Kinh nghiệm phát triển...,Ngô Lê Minh,Chỉ từ 23.000₫
Đầu tư bất động sản,Gary W. Eldred,Chỉ từ 71.000₫
Vẽ kỹ thuật cơ bản,Vũ Tiến Đạt,Chỉ từ 10.000₫
Bảo tồn và phát huy các giá trị di sản văn hóa tộc người Dao Quần Trắng tại tỉnh Yên Bái trong mối quan hệ với phát triển du lịch,Lê Thị Thu Phượng,Chỉ từ 15.000₫
Bài tập Cơ học lý thuyết,Bộ môn cơ học lý thuyết 1,Chỉ từ 17.000₫
83 câu hỏi đáp về soạn thảo và ban hành văn bản hành chính (Sách chuyên khảo),Phạm Thị Hồng Thắm,Chỉ từ 10.000₫
"Tiếng Anh chuyên ngành kiến trúc, xây dựng, quy hoạch và kỹ thuật xây dựng đô thị",Vi Thị Quốc Khánh,66.000₫
Bài tập sức bền vật liệu,Phạm Ngọc Khánh,167.000₫
Các bài nghiên cứu lý luận phê bình dịch thuật kiến trúc - Tập 3,Đặng Thái Hoàng,34.000₫
Nhựa đường và các loại mặt đường nhựa,Nguyễn Quang Chiêu,Chỉ từ 15.000₫
Kinh tế thuỷ lợi,Nguyễn Thượng Bằng,Chỉ từ 14.000₫
Kiến trúc cổ Việt Nam,Vũ Tam Lang,93.000₫
Hướng dẫn sử dụng phần mềm ALASKA VER 4.15,Đỗ Văn Đệ,Chỉ từ 10.000₫
Thiết kế kiến trúc công trình đầu mối hạ tầng kỹ thuật đô thị. Tập 1,Nguyễn Cao Lãnh,Chỉ từ 10.000₫
Nhà cao tầng - Thiết kế và xây dựng - Tập 1 Kiến trúc nhà cao tầng,Trịnh Hồng Đoàn,148.000₫
Kiến trúc,Nguyễn Đức Thiềm,Chỉ từ 24.000₫
Bê tông cho công trình biển,Phạm Hữu Hạnh,Chỉ từ 18.000₫
Công trình ngầm,Lê Văn Lạc,Chỉ từ 14.000₫
Quy hoạch xây dựng phát triển đô thị,Nguyễn Thế Bá - ĐHKTHN,Chỉ từ 22.000₫
Quy hoạch đô thị (Giáo trình dành cho...,Phạm Hùng Cường,Chỉ từ 15.000₫
Hệ thống giao thông thông minh trong...,Rodolfo I. Meneguette,Chỉ từ 48.000₫
Nhà ở xã hội - Kinh nghiệm phát triển...,Ngô Lê Minh,Chỉ từ 23.000₫
Đầu tư bất động sản,Gary W. Eldred,Chỉ từ 71.000₫
Vẽ kỹ thuật cơ bản,Vũ Tiến Đạt,Chỉ từ 10.000₫
Khía cạnh văn hoá xã hội của kiến trúc,Nguyễn Đức Thiềm,134.000₫
TCVN 2748:1991 Phân cấp công trình xây dựng - Nguyên tắc chung,Tiêu chuẩn quốc gia,Chỉ từ 10.000₫
Hỏi đáp pháp luật về phòng chống bạo lực gia đình,Bộ Lao động - Thương binh và Xã hội,Chỉ từ 10.000₫
TCVN 12251:2020 Bảo vệ chống ăn mòn cho kết cấu xây dựng - Protection against corrosion for building structures,Tiêu chuẩn quốc gia,Chỉ từ 10.000₫
Vi sinh vật nước và nước thải,Lâm Minh Triết,Chỉ từ 29.000₫
Kiến trúc công trình công cộng,Nguyễn Việt Châu,149.000₫
Phương pháp cố kết hút chân không xử lý nền đất yếu trong xây dựng công trình,Nguyễn Chiến,Chỉ từ 10.000₫
"Cẩm nang chính sách pháp luật đối với người nhiễm HIV, người điều trị thay thế nghiện chất dạng thuốc phiện, người cai nghiện và người bán dâm",Bộ Lao động - Thương binh và Xã hội,Chỉ từ 18.000₫
Máy và thiết bị nâng chuyển,Phạm Huy Chính,Chỉ từ 15.000₫
Cấp nước đô thị,Nguyễn Ngọc Dung,53.200₫
Giáo trình mô phỏng mạng lưới thoát nước bằng SWMM,Dương Thanh Lượng,Chỉ từ 23.000₫
Quản lý vận hành và thiết kế nâng cấp nhà máy nước,Trịnh Xuân Lai,87.500₫
Phương pháp phần tử hữu hạn và dải hữu hạn,Nguyễn Trâm,Chỉ từ 16.000₫
Sổ tay đồ án nội thất,Nguyễn Việt Khoa,83.000₫
"TCVN 12604-2:2019 Kết cấu bảo vệ bờ biển - Cấu kiện kè bê tông cốt sợi polyme đúc sẵn - Phần 2: Thi công và nghiệm thu - Coastal protection structures - Precast polymer fiber- reinforced concrete embankment member - Part 2: Construction and acceptance """,Tiêu chuẩn quốc gia,Chỉ từ 10.000₫
Cẩm nang bình đẳng giới và phòng chống bạo lực gia đình,Bộ Lao động - Thương binh và Xã hội,Chỉ từ 11.000₫
Quy hoạch đô thị (Giáo trình dành cho...,Phạm Hùng Cường,Chỉ từ 15.000₫
Hệ thống giao thông thông minh trong...,Rodolfo I. Meneguette,Chỉ từ 48.000₫
Nhà ở xã hội - Kinh nghiệm phát triển...,Ngô Lê Minh,Chỉ từ 23.000₫
Đầu tư bất động sản,Gary W. Eldred,Chỉ từ 71.000₫
Vẽ kỹ thuật cơ bản,Vũ Tiến Đạt,Chỉ từ 10.000₫
"Kỹ năng phòng, chống xâm hại, bắt cóc trẻ em và các chính sách pháp luật liên quan",Bộ Lao động - Thương binh và Xã hội,Chỉ từ 13.000₫
Tư duy và tổ hợp kiến trúc,Đặng Thái Hoàng,89.000₫
Quản lý các nguồn lực của dự án đầu tư xây dựng công trình,Bùi Mạnh Hùng,Chỉ từ 20.000₫
Tuyển tập đồ án quy hoạch 1 - Quy hoạch đơn vị ở,Khoa Kiến trúc - ĐHXD,33.600₫
Cơ học công trình,Trần Minh Tú,Chỉ từ 18.000₫
Giáo trình thực hành cơ bản nghề tiện (Dùng cho các Trường Đào tạo chuyên nghiệp và Dạy nghề),Trần Minh Hùng,Chỉ từ 33.000₫
TCVN 12002:2020 Kết cấu thép xây dựng - Chế tạo và kiểm tra chất lượng - Steel structures - Production and quality control,Tiêu chuẩn quốc gia,Chỉ từ 10.000₫
Giáo trình cao đẳng nghề hàn - Tập 3,Lê Văn Hiền,Chỉ từ 14.000₫
Giáo trình hàn TIG,Cao Đẳng Xây dựng Công trình Đô thị,36.000₫
Cơ học đất,Nguyễn Đình Dũng,66.500₫
Sổ tay xử lý nước Tập 1,Trung tâm đào tạo ngành nước và Môi trường,198.000₫
TCVN 7710:2007 Vật liệu chịu lửa - Gạch manhêdi cácbon - Refractories - Magnesia carbon bricks,Tiêu chuẩn quốc gia,Chỉ từ 10.000₫
TCVN 3745-2:2008 Bản vẽ kỹ thuật - Biểu diễn đơn giản đường ống - Phần 2: Hình chiếu trục đo - Technical drawings - Simplified representation of pipelines - Part 2: Isometric projection,Tiêu chuẩn quốc gia,Chỉ từ 10.000₫
Hư hỏng sửa chữa gia cường nền móng,Lê Văn Kiểm,Chỉ từ 19.000₫
Cơ sở địa chất cơ học đất và nền móng công trình,Nguyễn Uyên,147.000₫
Máy và thiết bị xây dựng,Nguyễn Văn Hùng,Chỉ từ 24.000₫
Quy hoạch đô thị (Giáo trình dành cho...,Phạm Hùng Cường,Chỉ từ 15.000₫
Hệ thống giao thông thông minh trong...,Rodolfo I. Meneguette,Chỉ từ 48.000₫
Nhà ở xã hội - Kinh nghiệm phát triển...,Ngô Lê Minh,Chỉ từ 23.000₫
Đầu tư bất động sản,Gary W. Eldred,Chỉ từ 71.000₫
Vẽ kỹ thuật cơ bản,Vũ Tiến Đạt,Chỉ từ 10.000₫
Tiếng Anh trong kỹ thuật tài nguyên nước,Bùi Công Quang,Chỉ từ 22.000₫
TCVN 8270:2009 - Quy hoạch cây xanh sử dụng hạn chế và chuyên dụng trong đô thị,Tiêu chuẩn quốc gia,Chỉ từ 10.000₫
Giáo trình quản lý quy hoạch kiến trúc cảnh quan và môi trường,Bộ Xây Dựng,30.800₫
Kiểm soát chi phí quản lý chất lượng trong các doanh nghiệp chế biến thủy hải sản tỉnh Nam Định trong bối cảnh hội nhập kinh tế quốc tế (Sách chuyên khảo),Trần Hoàng Long,Chỉ từ 17.000₫
Hỏi đáp về đối thoại tiền lương và tranh chấp lao động,Bộ Lao động - Thương binh và Xã hội,Chỉ từ 10.000₫
Giáo trình cao đẳng nghề hàn - Tập 1,Lê Văn Hiền,Chỉ từ 15.000₫
Thi công hầm và công trình ngầm,Nguyễn Xuân Trọng,100.100₫
Kết cấu composites,Nguyễn Trâm,Chỉ từ 12.000₫
TCXDVN 276:2003 Công trình công cộng - nguyên tắc cơ bản để thiết kế,Tiêu chuẩn quốc gia,Chỉ từ 10.000₫
Truyền động tàu thủy,Lưu Đình Hiếu,Chỉ từ 20.000₫
Giáo trình Ma sát Mòn Bôi trơn TRIBOLOGY,Nguyễn Doãn Ý,Chỉ từ 27.000₫
"TCVN 7951:2008, TCVN 7952-1-11:2008, TCVN 7953:2008 Hệ chất kết dính gốc nhựa EPOXY cho bê tông",Tiêu chuẩn quốc gia,Chỉ từ 10.000₫
Thiết kế và xây dựng mặt đường sân bay,Nguyễn Quang Chiêu,Chỉ từ 18.000₫
Hướng dẫn công tác phòng chống tệ nạn ma túy và chăm sóc người nghiện,Bộ Lao động - Thương binh và Xã hội,Chỉ từ 10.000₫
Lý thuyết kiến trúc,Nguyễn Mạnh Thu,94.000₫
Thiết kế và thi công cầu bê tông chất...,Phạm Duy Hòa,Chỉ từ 15.000₫
Mối quan hệ kiến trúc và các ngành...,Tôn Thất Đại,Chỉ từ 12.000₫
Kiến trúc nhà ở người dân tộc Chăm...,TS.KTS. Trịnh Hồng Việt,Chỉ từ 13.000₫
Sổ tay hướng dẫn quy hoạch mạng lưới...,Phan Tiến Tâm,Chỉ từ 10.000₫
QCVN 01:2021/BXD Quy chuẩn xây dựng...,Tiêu chuẩn quốc gia,Chỉ từ 10.000₫
Xử lý nước thải công nghiệp 2020,Trịnh Xuân Lai,64.000₫
Kỹ thuật canh tác sắn bền vững,Nguyễn Viết Hưng,Chỉ từ 10.000₫
Thống kê học trong nghiên cứu khoa học,Nguyễn Ngọc Kiểng,Chỉ từ 21.000₫
Hướng dẫn thiết kế thi công chống thấm,Đặng Đình Minh,34.000₫
TCVN 6084:2012 (ISO 3766:2003) Bản vẽ xây dựng thể hiện cốt thép bê tông - Construction drawingsSimplified representation of concrete reinforcement,Tiêu chuẩn quốc gia,Chỉ từ 10.000₫
Thi công các công trình thủy lợi - tập 1,Trường ĐH Thủy lợi,Chỉ từ 30.000₫
Truyền thông phòng chống xâm hại tình dục và các tệ nạn xã hội trong nhà trường,Nguyễn Anh,Chỉ từ 17.000₫
Đánh giá độ bền và độ bền mỏi kết cấu giá xe chuyển hướng và trục đầu máy Diesel,Đỗ Đức Tuấn,Chỉ từ 13.000₫
Kiến trúc cảnh quan,Hàn Tất ngạn,Chỉ từ 19.000₫
Kiến trúc công trình,Nguyễn Tài My,Chỉ từ 31.000₫
TCVN 4448:1987 Hướng dẫn lập quy hoạch xây dựng thị trấn huyện lỵ - Guidance for making provincial district building plans,Tiêu chuẩn quốc gia,Chỉ từ 10.000₫
TCVN 2682:2009 Xi măng Poóc lăng - Yêu cầu kỹ thuật - Portland cements - Specifications,Tiêu chuẩn quốc gia,Chỉ từ 10.000₫
TCVN 6078:2012 (ISO 4172:1991) Bản vẽ kỹ thuật - Bản vẽ xây dựng - Bản vẽ lắp ghép kết cấu chế tạo sẵn - Technical drawings - Construction drawings - Drawings for the assembly of prefabricated structures,Tiêu chuẩn quốc gia,Chỉ từ 10.000₫
Những kiến thức cơ bản về GIS và ứng dụng trong quy hoạch xây dựng đô thị,Nguyễn Bá Quảng,Chỉ từ 13.000₫
Ngôn ngữ hình thức kiến trúc - Tập 2,La Văn Ái,Chỉ từ 22.000₫
"Hỏi đáp pháp luật về thời giờ làm việc, thời giờ nghỉ ngơi và an toàn lao động, vệ sinh lao động",Bộ Lao động - Thương binh và Xã hội,Chỉ từ 13.000₫
Thiết kế và thi công cầu bê tông chất...,Phạm Duy Hòa,Chỉ từ 15.000₫
Mối quan hệ kiến trúc và các ngành...,Tôn Thất Đại,Chỉ từ 12.000₫
Kiến trúc nhà ở người dân tộc Chăm...,TS.KTS. Trịnh Hồng Việt,Chỉ từ 13.000₫
Sổ tay hướng dẫn quy hoạch mạng lưới...,Phan Tiến Tâm,Chỉ từ 10.000₫
QCVN 01:2021/BXD Quy chuẩn xây dựng...,Tiêu chuẩn quốc gia,Chỉ từ 10.000₫
"Hướng dẫn quy hoạch đô thị điểm dân cư nông thôn trong khu vực chịu ảnh hưởng của lũ ống, lũ quét và sạt lở đất",Lưu Đức Cường,Chỉ từ 17.000₫
TCVN 3907:2011 Trường Mầm non - Yêu cầu thiết kế,Tiêu chuẩn quốc gia,15.400₫
Công nghệ - máy và thiết bị thi công công trình ngầm dạng tuyến,Bùi Mạnh Hùng,Chỉ từ 19.000₫
Giáo trình cấu tạo máy ủi - cạp - san,Trường Cao đẳng nghề Việt Xô số 1,34.300₫
Quang học kiến trúc,Việt Hà,116.000₫
Nghiệp vụ đấu thầu,Bùi Mạnh Hùng,Chỉ từ 11.000₫
Giáo trình kỹ thuật xử lý chất thải công nghiệp,Nguyễn Văn Phước,Chỉ từ 31.000₫
Sổ tay địa chất thủy văn,Nguyễn Uyên,Chỉ từ 50.000₫
Thiết kế kết cấu thép theo tiêu chuẩn Anh BS 5950:Part 1:2000,Đoàn Định Kiến,64.000₫
TCVN 11361-1:2016 (EN 12629-1:2000) Máy sản xuất các sản phẩm xây dựng từ hỗn hợp bê tông và vôi cát - An toàn - Phần 1: Yêu cầu chung - Machines for the manufacture of constructional products from concrete and calcium-silicate - Safety- Part 1: Common requirements,Tiêu chuẩn quốc gia,Chỉ từ 10.000₫
TCVN 12860:2020 Máy đào hầm - Buồng khí áp - Yêu cầu an toàn - Tunnelling machines - Air locks - Safety requirements,Tiêu chuẩn quốc gia,Chỉ từ 10.000₫
Hướng dẫn đồ án môn học nhà máy thuỷ điện (nguyễn thanh hảo ),Nguyễn Thanh Hảo,Chỉ từ 11.000₫
Giáo trình mô phỏng mạng lưới cấp nước bằng phần mềm Epanet,Dương Thanh Lượng,80.000₫
Kỹ thuật xây dựng móng cầu Tập 1,Nguyễn Trâm,Chỉ từ 20.000₫
Thiết kế hầm giao thông,Nguyễn Thế Phùng,Chỉ từ 31.000₫
Thi công móng trụ mố cầu,Nguyễn Trâm,Chỉ từ 36.000₫
Thiết kế và thi công cầu bê tông chất...,Phạm Duy Hòa,Chỉ từ 15.000₫
Mối quan hệ kiến trúc và các ngành...,Tôn Thất Đại,Chỉ từ 12.000₫
Kiến trúc nhà ở người dân tộc Chăm...,TS.KTS. Trịnh Hồng Việt,Chỉ từ 13.000₫
Sổ tay hướng dẫn quy hoạch mạng lưới...,Phan Tiến Tâm,Chỉ từ 10.000₫
QCVN 01:2021/BXD Quy chuẩn xây dựng...,Tiêu chuẩn quốc gia,Chỉ từ 10.000₫
Cẩm nang công tác xã hội đối với trẻ em và gia đình,Bộ Lao động - Thương binh và Xã hội,Chỉ từ 15.000₫
"TCVN 4612:1988 Hệ thống tài liệu thiết kế xây dựng - Kết cấu bê tông cốt thép - Ký hiệu quy ước và thể hiện bản vẽ - System of documents for building design - Reinforced concrete structures conventional symbols and representation on drawings """,Tiêu chuẩn quốc gia,Chỉ từ 10.000₫
Kiến trúc hướng dòng thông gió tự nhiên,Nguyễn Tăng Nguyệt Thu,83.000₫
TCVN 4199:1995 Đất xây dựng - Phương pháp xác định sức chống cắt trong phòng thí nghiệm ở máy cắt phẳng - Soil - Laboratory method of determination of shear resistance in a shear box appratus,Tiêu chuẩn quốc gia,Chỉ từ 10.000₫
"TCVN 9376:2012 Nhà ở lắp ghép tấm lớn - Thi công và nghiệm thu công tác lắp ghép - Residential building from precast reinforced concrete large panel - Construction, check and acceptance",Tiêu chuẩn quốc gia,Chỉ từ 10.000₫
Thiết kế thông gió công nghiệp,Hoàng Thị Hiền,89.600₫
TCVN 9113:2012 Ống bê tông cốt thép thoát nước - Reinforced concrete pipes for water draining,Tiêu chuẩn quốc gia,Chỉ từ 10.000₫
"Kết cấu bê tông và bê tông cốt thép, quy phạm anh quốc BS8110-1997",Nguyễn Trung Hòa,Chỉ từ 20.000₫
Chính sách hỗ trợ ngư dân phát triển sản xuất,Bộ Lao động - Thương binh và Xã hội,Chỉ từ 19.000₫
TCVN 9080-7:2012 Vữa bền hoá gốc polyme - Phương pháp thử - Phần 7: Xác định độ bền hoá - Chemical-resistant polymer mortars - Test methods - Part 7: Determination of chemical resistance,Nhà xuất bản Xây dựng - Bộ Xây dựng,Chỉ từ 10.000₫
TCVN 11720:2016 (BS EN 13310:2003) Bồn rửa nhà bếp - Yêu cầu chức năng và phương pháp thử - Kitchen sinks - Functional requirements and test methods,Tiêu chuẩn quốc gia,Chỉ từ 10.000₫
Truyền thông về y tế học đường (Cẩm nang trong trường học và gia đình),Nguyễn Anh,Chỉ từ 24.000₫
Quản lý nhà nước về kinh tế và quản trị kinh doanh trong xây dựng,Nguyễn Văn Chọn,179.000₫
TCVN 9377-1:2012 Công tác hoàn thiện trong xây dưng - Thi công và nghiệm thu - Phần 1: Công tác lát và láng trong xây dựng - Finish works in construction - Execution and acceptance - Part 1: Paving and Smoothing works,Tiêu chuẩn quốc gia,Chỉ từ 10.000₫
Kỹ thuật điều khiển trong xây dựng,Lê Nho Bội,Chỉ từ 29.000₫
Quản lý hạ tầng kỹ thuật,Phạm Trọng Mạnh,Chỉ từ 18.000₫
Thiết kế và thi công cầu bê tông chất...,Phạm Duy Hòa,Chỉ từ 15.000₫
Mối quan hệ kiến trúc và các ngành...,Tôn Thất Đại,Chỉ từ 12.000₫
Kiến trúc nhà ở người dân tộc Chăm...,TS.KTS. Trịnh Hồng Việt,Chỉ từ 13.000₫
Sổ tay hướng dẫn quy hoạch mạng lưới...,Phan Tiến Tâm,Chỉ từ 10.000₫
QCVN 01:2021/BXD Quy chuẩn xây dựng...,Tiêu chuẩn quốc gia,Chỉ từ 10.000₫
Tổ chức thi công,Nguyễn Đình Hiện,40.000₫
Thủy lực cơ sở,Phùng Văn Khương,Chỉ từ 16.000₫
TCVN 11945-1:2018 (ISO 24337:2006) Ván lát sàn nhiều lớp - Phần 1: Xác định đặc trưng hình học - Laminate floor coverings - Determination of geometrical characteristics,Tiêu chuẩn quốc gia,Chỉ từ 10.000₫
Lập tiến độ thi công sử dụng phần mềm DT & MS trong xây dựng,Bùi Hùng,Chỉ từ 16.000₫
Tự động hoá các công trình cấp và thoát nước,Phạm Thị Giới,Chỉ từ 18.000₫
Sổ tay phòng chống bạo lực gia đình,Bộ Lao động - Thương binh và Xã hội,Chỉ từ 13.000₫
TCVN 12092:2018 (EN 13862:2010) Máy cắt sàn - An toàn - Floor cutting-off machines - Safety,Tiêu chuẩn quốc gia,Chỉ từ 10.000₫
Trang bị điện máy xây dựng,Trương Tri Ngộ,Chỉ từ 19.000₫
Hướng dẫn kỹ thuật xây dựng nhà vùng bão lụt,K.J.Macks,Chỉ từ 14.000₫
"Sổ tay công tác bảo vệ, chăm sóc giáo dục và hỗ trợ pháp lý, tư vấn, trị liệu tâm lý trẻ em có hoàn cảnh đặc biệt",Bộ Lao động - Thương binh và Xã hội,Chỉ từ 11.000₫
Trăm lẻ một kinh nghiệm làm nhà,Ngô Huy Nam,125.000₫
TCVN 9360:2012 Quy trình kỹ thuật xác định độ lún công trình dân dụng và công nghiệp bằng phương pháp đo cao hình học - Technical process of settlement monitoring of civil and industrial building by geometrical levelling,Tiêu chuẩn quốc gia,Chỉ từ 10.000₫
TCVN 8256:2009 Tấm thạch cao - Yêu cầu kỹ thuật - Gypsum boards - Specifications,Tiêu chuẩn quốc gia,Chỉ từ 10.000₫
TCVN 8794:2011 Trường Trung học - Yêu cầu thiết kế,Tiêu chuẩn quốc gia,14.000₫
TCVN 11870-1:2017 (BS EN 274-1:2002) Phụ kiện thoát nước cho thiết bị vệ sinh - Phần 1: Yêu cầu kỹ thuật - Waste fittings for sanitary appliances - Part 1: Requirements,Tiêu chuẩn quốc gia,Chỉ từ 10.000₫
TCVN 5040:1990 (ISO 6790:1986) Thiết bị phòng cháy và chữa cháy - Ký hiệu hình vẽ dùng trên sơ đồ phòng cháy - Yêu cầu kỹ thuật - Fire prevention and protection equipments - Graphical symbols used for protection schemes - Specifications,Tiêu chuẩn quốc gia,Chỉ từ 10.000₫
Cấp thoát nước trong nhà và công trình,Nguyễn Phương Thảo,Chỉ từ 30.000₫
Thiết kế và thi công cầu bê tông chất...,Phạm Duy Hòa,Chỉ từ 15.000₫
Mối quan hệ kiến trúc và các ngành...,Tôn Thất Đại,Chỉ từ 12.000₫
Kiến trúc nhà ở người dân tộc Chăm...,TS.KTS. Trịnh Hồng Việt,Chỉ từ 13.000₫
Sổ tay hướng dẫn quy hoạch mạng lưới...,Phan Tiến Tâm,Chỉ từ 10.000₫
Giáo trình Nguyên lý máy,Bùi Lê Gôn,67.000₫
Lý thuyết ăn mòn và chống ăn mòn Bê tông - Bê tông cốt thép trong xây dựng,Nguyễn Mạnh Phát,44.000₫
Hỏi đáp chính sách dạy nghề chuyên biệt và giải quyết việc làm cho con em dân tộc thiểu số,Bộ Lao động - Thương binh và Xã hội,Chỉ từ 11.000₫
Trắc địa cơ sở - tập 1,Nguyễn Trọng San,105.000₫
Tính toán thực hành cấu kiện bêtông cốt thép theo tiêu chuẩn TCXDVN 356:2005 Tập 1,Tiêu chuẩn quốc gia,59.000₫
Đánh giá tác động môi trường,Cù Huy Đấu,Chỉ từ 13.000₫
TCVN 12873:2020 Căn hộ lưu trú - Yêu cầu chung về thiết kế - Condotel - General Requirements for Design,Tiêu chuẩn quốc gia,Chỉ từ 10.000₫
"TCVN 9391:2012 Lưới thép hàn dùng trong kết cấu bê tông cốt thép - Tiêu chuẩn thiết kế, thi công lắp đặt và nghiệm thu - Welded steel mesh for the reinforcement of concrete - Standard for design, placing and acceptance",Tiêu chuẩn quốc gia,Chỉ từ 10.000₫
Giáo trình sửa chữa hệ thống di chuyển,Trường Cao đẳng nghề Việt Xô số 1,27.300₫
Kết cấu chuyên dụng bê tông cốt thép,Lê Thanh Huấn,Chỉ từ 18.000₫
TCVN 8653-5:2012 Sơn tường dạng nhũ tương - Phương pháp thử - Phần 5: Xác định độ bền chu kỳ nóng lạnh của màng sơn - Wall emulsion paints - Test methods - Part 5: Determination of heat sock resistance of paint film,Tiêu chuẩn quốc gia,Chỉ từ 10.000₫
Thiết kế nhà và một số công trình kỹ thuật trong xí nghiệp công nghiệp,Lương Bá Chấn,Chỉ từ 16.000₫
Tổ chức sản xuất xây dựng,Lê Kiều,Chỉ từ 18.000₫
Dân số học đô thị,Trần Hùng,Chỉ từ 13.000₫
Quản lý Nhà nước của Ủy ban nhân dân các cấp về xây dựng nông thôn mới ở nước ta,Nguyễn Công Dũng,Chỉ từ 19.000₫
Công tác bê tông trong điều kiện khí hậu nóng ẩm Việt Nam,Nguyễn Tiến Đích,Chỉ từ 20.000₫
Thiết kế và thi công cầu bê tông chất...,Phạm Duy Hòa,Chỉ từ 15.000₫
Mối quan hệ kiến trúc và các ngành...,Tôn Thất Đại,Chỉ từ 12.000₫
Kiến trúc nhà ở người dân tộc Chăm...,TS.KTS. Trịnh Hồng Việt,Chỉ từ 13.000₫
Sổ tay hướng dẫn quy hoạch mạng lưới...,Phan Tiến Tâm,Chỉ từ 10.000₫
QCVN 01:2021/BXD Quy chuẩn xây dựng...,Tiêu chuẩn quốc gia,Chỉ từ 10.000₫
TCVN 2096-2:2015 Sơn và vecni - Phương pháp xác định độ khô và thời gian khô - Phần 2: Thử nghiệm áp lực đối với khả năng xếp chồng - Paints and varnishes - Drying tests -Part 2: Pressure test for stackability,Tiêu chuẩn quốc gia,Chỉ từ 10.000₫
QCXDVN 05:2008/BXD Quy chuẩn xây dựng Việt Nam nhà ở và công trình công cộng an toàn sinh mạng và sức khỏe,Tiêu chuẩn quốc gia,Chỉ từ 10.000₫
Cơ học môi trường liên tục,Trần Văn Liên,Chỉ từ 31.000₫
TCVN 7952-7:2008 Hệ chất kết dính gốc nhựa epoxy cho bê tông - Phương pháp thử - Phần 7: Xác định khả năng thích ứng nhiệt - Epoxy resin base bonding systems for concrete - Test methods - Part 7: Determination of thermal compatibility,Tiêu chuẩn quốc gia,Chỉ từ 10.000₫
TCVN 10333-2:2014 Hố ga bê tông cốt thép thành mỏng đúc sẵn - Phần 2: Giếng thăm hình hộp - Precast thin wall reinforced concrete manholes - Part 2: Box manholes,Tiêu chuẩn quốc gia,Chỉ từ 10.000₫
TCVN 8257-4:2009 Tấm thạch cao - Phương pháp thử - Phần 4: Xác định độ kháng nhổ đinh - Gypsum boards - Test methods - Part 4: Determination of nail pull resistance,Tiêu chuẩn quốc gia,Chỉ từ 10.000₫
Giáo trình điện công nghiệp,Bùi Hồng Huế,130.000₫
"Tiêu chuẩn Bảo vệ công trình xây dựng, phòng chống mối cho công trình xây dựng mới",Bộ Xây Dựng,Chỉ từ 10.000₫
TCVN 9080-3:2012 Vữa bền hoá gốc polyme - Phương pháp thử - Phần 3: Phương pháp xác định độ bám dính - Chemical-resistant polymer mortars - Test methods - Part 3: Determination of bond strength,Tiêu chuẩn quốc gia,Chỉ từ 10.000₫
Chế độ chính sách và trợ cấp một lần cho người có công với cách mạng,Bộ Lao động - Thương binh và Xã hội,Chỉ từ 14.000₫
